id,term,translation,description,difficulty,category,image_url,audio_url,created_at,description_translation
82298c42-98d9-450e-933c-3af23394c6f9,Hacer un cambio de sentido	,Разворот (смена направления)	,Girar para ir en la dirección opuesta.	,medium,8ca8a29a-d9b5-4fe9-917d-a1083de7bef1,,,2025-03-10 20:40:36.063235+00,Поворот для движения в противоположном направлении.
8521f90c-3dad-49dc-8f8c-f9b4d47ecad8,Luz trasera,	Задняя фара,"	Luz ubicada en la parte trasera del coche.	
",medium,43199b83-ee89-467f-bd3b-d2acb5e04952,,,2025-03-10 19:04:31.137129+00,"Фара, расположенная в задней части автомобиля."
878c1817-f98d-4215-9a69-88553c04b994," Esquivar	",Уклоняться,Moverse rápidamente para evitar un choque.	,medium,8ca8a29a-d9b5-4fe9-917d-a1083de7bef1,,,2025-03-10 20:19:52.768836+00,"Быстро перемещаться, чтобы избежать столкновения."
882507f3-275b-4e6f-8799-177811ae37d3,Frenar,Тормозить,Reducir la velocidad o detener el vehículo.	,medium,a8a3a4bc-a58f-469e-b648-b35e397cf893,,,2025-03-03 18:04:46.325363+00,Снижение скорости или остановка транспортного средства.
883b07c4-c5ee-4b57-808c-8365948912ea," Volante",Руль,	Dispositivo para dirigir el coche.	,medium,43199b83-ee89-467f-bd3b-d2acb5e04952,,,2025-03-10 19:39:33.195712+00,Устройство для управления автомобилем.
897a11d1-8e4c-4eaf-a78d-18b2a0c12b9c,Mantener la distancia	,Соблюдать дистанцию,	Conservar un espacio seguro con el vehículo delantero.	,medium,8ca8a29a-d9b5-4fe9-917d-a1083de7bef1,,,2025-03-10 20:13:38.615635+00,Соблюдать безопасное расстояние с впереди идущим транспортным средством.
8ab17fee-9e08-4303-a1e1-02d2f2dc9988," Embrague	",Сцепление,Dispositivo que conecta el motor con la caja de cambios.	,medium,43199b83-ee89-467f-bd3b-d2acb5e04952,,,2025-03-10 19:54:41.327741+00,"Устройство, соединяющее двигатель с коробкой передач.
"
8d40370a-8e8e-4c48-bd1b-b63d71d06c8f,Encendido,	Зажигание	,Mecanismo para arrancar el motor.	,medium,43199b83-ee89-467f-bd3b-d2acb5e04952,,,2025-03-10 19:39:52.51602+00,Механизм для запуска двигателя.
8ddbf413-ae4b-4733-bfad-aecd9d139f71," Radiador	",Радиатор,Dispositivo para enfriar el motor.	,medium,43199b83-ee89-467f-bd3b-d2acb5e04952,,,2025-03-10 19:46:10.418546+00,Устройство для охлаждения двигателя.
8e478237-a9c0-45c1-9ae8-13472fbbf6d1," Luz interior	",Свет в салоне	,Iluminación dentro del coche.	,medium,43199b83-ee89-467f-bd3b-d2acb5e04952,,,2025-03-10 19:53:28.230663+00,Освещение внутри автомобиля.
901880f3-444a-4f70-a1fa-e853387a13e0,Puerta de coche	,Дверца	,Puerta lateral del vehículo.	,medium,43199b83-ee89-467f-bd3b-d2acb5e04952,,,2025-03-10 19:03:25.538158+00,Боковая дверь автомобиля.
9b023f93-bdff-46d8-94b9-7d5ad028801b,Escape,Выхлопная труба	,Tubo por donde salen los gases del motor.	,medium,43199b83-ee89-467f-bd3b-d2acb5e04952,https://tec2go.com.es/cdn/shop/files/escape1.jpg?v=1712318304,,2025-03-10 19:07:54.378905+00,"Труба, через которую выходят выхлопные газы."
9cd6dea9-91dd-49af-a2eb-2349fb963fb5," Líquido de frenos	",Тормозная жидкость,	Líquido que transmite la presión en el sistema de frenos.	,medium,43199b83-ee89-467f-bd3b-d2acb5e04952,,,2025-03-10 19:45:51.988925+00,"Жидкость, передающая давление в тормозной системе."